{
  "$schema": "https://json-schema.org/draft/2020-12/schema",
  "$id": "https://raw.githubusercontent.com/grimoire-codex/community-add-ons/main/schema/character-sheet.schema.json",
  "title": "Grimoire character sheet",
  "description": "A schema-driven character sheet: the fields a character has, the values derived from them, and how the sheet is drawn. Grimoire renders any sheet here without game-specific code.",
  "type": "object",
  "required": [
    "id",
    "name",
    "version",
    "fields"
  ],
  "additionalProperties": false,
  "properties": {
    "$schema": {
      "type": "string",
      "description": "JSON Schema reference"
    },
    "id": {
      "type": "string",
      "pattern": "^[a-z0-9]+([-_][a-z0-9]+)*$",
      "description": "Lowercase, hyphenated; must match the directory name."
    },
    "name": {
      "type": "string",
      "minLength": 1
    },
    "version": {
      "type": "string",
      "pattern": "^\\d+\\.\\d+\\.\\d+$"
    },
    "system": {
      "type": "string",
      "description": "The game this sheet is for, shown in the picker. Display-only."
    },
    "description": {
      "type": "string"
    },
    "author": {
      "type": "string",
      "maxLength": 120,
      "description": "Who wrote this sheet. A GitHub username (e.g. 'hunter-read') links to that profile in Grimoire; any other text is credited without a link."
    },
    "homepage": {
      "type": "string"
    },
    "grimoire_min_version": {
      "type": "string",
      "pattern": "^\\d+\\.\\d+\\.\\d+$"
    },
    "license": {
      "type": "string",
      "description": "The licence the sheet's content is published under (e.g. 'CC-BY-4.0', 'ORC', 'Draw Steel Creator License')."
    },
    "license_url": {
      "type": "string"
    },
    "attribution": {
      "type": "string",
      "maxLength": 2000,
      "description": "Credit for the upstream game, rendered verbatim in Grimoire wherever this sheet is browsed or used. Some licences require exact wording — reproduce it here character for character."
    },
    "fields": {
      "type": "object",
      "description": "The editable state of a character, keyed by field name.",
      "minProperties": 1,
      "maxProperties": 1000,
      "propertyNames": {
        "pattern": "^[A-Za-z_][A-Za-z0-9_]*$"
      },
      "additionalProperties": {
        "type": "object",
        "required": [
          "type"
        ],
        "additionalProperties": false,
        "properties": {
          "type": {
            "enum": [
              "text",
              "number",
              "textarea",
              "checkbox",
              "select",
              "multiselect",
              "list",
              "content_ref",
              "content_list",
              "image"
            ]
          },
          "label": {
            "type": "string"
          },
          "placeholder": {
            "type": "string"
          },
          "default": {},
          "min": {
            "type": "number"
          },
          "max": {
            "type": "number"
          },
          "rows": {
            "type": "integer",
            "minimum": 1,
            "maximum": 40
          },
          "options": {
            "type": "array",
            "minItems": 1,
            "description": "Required for type 'select'. Either plain values or {value, label} objects.",
            "items": {
              "oneOf": [
                {
                  "type": [
                    "string",
                    "number"
                  ]
                },
                {
                  "type": "object",
                  "required": [
                    "value"
                  ],
                  "additionalProperties": false,
                  "properties": {
                    "value": {
                      "type": [
                        "string",
                        "number"
                      ]
                    },
                    "label": {
                      "type": "string"
                    }
                  }
                }
              ]
            }
          },
          "visible_if": {
            "type": "string",
            "description": "An expression; the field is drawn only when it is true. A condition that cannot be evaluated shows the field, because hiding part of a sheet over a broken expression would cost the player access to their own data."
          },
          "default_from": {
            "type": "string",
            "description": "An expression giving this field's value until the player sets one - e.g. ref(species, 'speed'). The player can always type over it, and reset it back. May read fields but not computed values, which are worked out after it. An empty result falls back to 'default'."
          },
          "on_pick": {
            "type": "array",
            "maxItems": 20,
            "description": "content_ref only. What picking an entry does to other fields. Everything a pick adds is recorded, so changing the pick takes it back off. The player can still edit the result freely.",
            "items": {
              "type": "object",
              "additionalProperties": false,
              "oneOf": [
                {
                  "required": [
                    "grant"
                  ],
                  "description": "Add values from the picked entry. Into a multiselect: 'from' names a list property. Into a content_list: 'ref' names an entry id, falling back to 'name' as a freeform entry when the catalog has no such entry."
                },
                {
                  "required": [
                    "choose"
                  ],
                  "description": "Ask the player to choose 'count' values from the entry's 'from' list, into a multiselect."
                }
              ],
              "properties": {
                "grant": {
                  "type": "string",
                  "description": "The field to add to."
                },
                "choose": {
                  "type": "string",
                  "description": "The multiselect field to choose into."
                },
                "from": {
                  "type": "string",
                  "description": "The picked entry's property to read values or options from. For a grant into a content_list, a list (or comma-separated text) of entry ids to add."
                },
                "ref": {
                  "type": "string",
                  "description": "The picked entry's property holding an entry id to grant."
                },
                "name": {
                  "type": "string",
                  "description": "The picked entry's property holding a name to grant when the id is not installed."
                },
                "count": {
                  "description": "How many to choose: a number, or the name of the picked entry's property holding it.",
                  "oneOf": [
                    {
                      "type": "integer",
                      "minimum": 1,
                      "maximum": 20
                    },
                    {
                      "type": "string"
                    }
                  ]
                },
                "label": {
                  "type": "string",
                  "maxLength": 200,
                  "description": "The prompt shown for a choice."
                },
                "names": {
                  "type": "string",
                  "description": "With a content_list `from`: the property listing each entry's name, in the same order - what each is added as when the catalog does not have its id."
                },
                "carry": {
                  "type": "object",
                  "additionalProperties": {
                    "type": "string"
                  },
                  "description": "Values copied from the picked entry onto each granted freeform entry, as {target field: picked property} - the species' name as each trait's source."
                }
              }
            }
          },
          "columns": {
            "type": "array",
            "minItems": 1,
            "maxItems": 20,
            "description": "Required for type 'list'. Each column is a field definition with a 'key'. A column may be any scalar type but not another list.",
            "items": {
              "type": "object",
              "required": [
                "key"
              ],
              "properties": {
                "key": {
                  "type": "string",
                  "pattern": "^[A-Za-z_][A-Za-z0-9_]*$"
                },
                "type": {
                  "enum": [
                    "text",
                    "number",
                    "checkbox",
                    "select",
                    "textarea"
                  ]
                },
                "label": {
                  "type": "string"
                },
                "default": {},
                "flex": {
                  "type": "number"
                },
                "min": {
                  "type": "number"
                },
                "max": {
                  "type": "number"
                },
                "options": {
                  "type": "array",
                  "minItems": 1
                }
              }
            }
          },
          "content_type": {
            "type": "string",
            "description": "Required for content_ref/content_list: the content type this field picks from. Must be one the schema declares."
          },
          "per_entry_fields": {
            "type": "object",
            "description": "The character's own notes on a referenced entry — prepared, equipped, uses remaining. Ordinary field definitions.",
            "additionalProperties": {
              "type": "object"
            }
          },
          "allow_freeform": {
            "type": "boolean",
            "description": "Lets a player type an entry instead of picking one, so the catalog stays optional."
          },
          "add_label": {
            "type": "string"
          },
          "empty_text": {
            "type": "string"
          },
          "display_columns": {
            "type": "array",
            "maxItems": 12,
            "description": "content_list only. Draw the list as a table of these properties of each picked entry - a spell's level, casting time and range - rather than a name and a one-line summary.",
            "items": {
              "oneOf": [
                {
                  "type": "string"
                },
                {
                  "type": "object",
                  "required": [
                    "key"
                  ],
                  "additionalProperties": false,
                  "properties": {
                    "key": {
                      "type": "string"
                    },
                    "label": {
                      "type": "string"
                    }
                  }
                }
              ]
            }
          }
        }
      }
    },
    "computed": {
      "type": "object",
      "description": "Values derived from fields. Read-only, recalculated on every read, never stored.",
      "maxProperties": 1500,
      "propertyNames": {
        "pattern": "^[A-Za-z_][A-Za-z0-9_]*$"
      },
      "additionalProperties": {
        "type": "object",
        "required": [
          "formula"
        ],
        "additionalProperties": false,
        "properties": {
          "formula": {
            "type": "string",
            "minLength": 1,
            "description": "An expression over other fields. Arithmetic, comparison, logic, and the closed function table: floor, ceil, round, abs, min, max, sum, len, if, clamp, signed. Parsed, never executed."
          },
          "label": {
            "type": "string"
          }
        }
      }
    },
    "layout": {
      "type": "array",
      "description": "The simple sheet: sections of fields, drawn in a responsive grid. Omit it (and layout_html) and Grimoire lists every field in declaration order.",
      "items": {
        "type": "object",
        "additionalProperties": false,
        "properties": {
          "title": {
            "type": "string"
          },
          "fields": {
            "type": "array",
            "items": {
              "oneOf": [
                {
                  "type": "string"
                },
                {
                  "type": "object",
                  "required": [
                    "field"
                  ],
                  "additionalProperties": false,
                  "properties": {
                    "field": {
                      "type": "string"
                    }
                  }
                }
              ]
            }
          },
          "visible_if": {
            "type": "string",
            "description": "The whole section is drawn only when this expression is true."
          }
        }
      }
    },
    "layout_html": {
      "type": "string",
      "maxLength": 262144,
      "description": "A custom sheet as an HTML template, written inline. Prefer 'layout_file' for anything longer than a line or two — HTML embedded in JSON has to be escaped, which makes it unreadable and unmaintainable."
    },
    "styles": {
      "type": "string",
      "maxLength": 131072,
      "description": "CSS for the layout, written inline. Prefer 'styles_file' for anything substantial."
    },
    "validators": {
      "type": "array",
      "maxItems": 200,
      "description": "Rules checked against a character. A rule states what should be true, so a false result is reported. They never block saving.",
      "items": {
        "type": "object",
        "required": [
          "rule",
          "message"
        ],
        "additionalProperties": false,
        "properties": {
          "rule": {
            "type": "string",
            "minLength": 1
          },
          "message": {
            "type": "string",
            "minLength": 1
          },
          "severity": {
            "enum": [
              "warning",
              "error"
            ]
          },
          "field": {
            "type": "string"
          }
        }
      }
    },
    "content_types": {
      "type": "object",
      "maxProperties": 50,
      "description": "Typed catalogs a character can reference — spells, classes, feats. A content type is a field schema applied to entries rather than to a character.",
      "propertyNames": {
        "pattern": "^[A-Za-z_][A-Za-z0-9_]*$"
      },
      "additionalProperties": {
        "type": "object",
        "required": [
          "fields"
        ],
        "additionalProperties": false,
        "properties": {
          "label": {
            "type": "string"
          },
          "label_plural": {
            "type": "string"
          },
          "icon": {
            "type": "string"
          },
          "identity_field": {
            "type": "string",
            "description": "The entry's name — what a reference shows and what the catalog sorts by. Must be one of the type's own fields."
          },
          "sort_default": {
            "type": "array",
            "items": {
              "type": "string"
            }
          },
          "search_fields": {
            "type": "array",
            "items": {
              "type": "string"
            }
          },
          "filter_fields": {
            "type": "array",
            "items": {
              "type": "string"
            }
          },
          "compact_display": {
            "type": "string",
            "description": "A one-line template like '{name} — {school} {level}'. Every {token} must name one of the type's fields."
          },
          "fields": {
            "type": "object",
            "minProperties": 1,
            "additionalProperties": {
              "type": "object"
            }
          }
        }
      }
    },
    "layout_file": {
      "type": "string",
      "maxLength": 255,
      "description": "A sibling .html file holding the layout, instead of inlining it. Defaults to '<id>.html' when that file exists. This is how a real sheet should be written: the HTML stays HTML, with syntax highlighting and no escaping."
    },
    "styles_file": {
      "type": "string",
      "maxLength": 255,
      "description": "A sibling .css file holding the stylesheet, instead of inlining it. Defaults to '<id>.css' when that file exists."
    },
    "mobile_layout_file": {
      "type": "string",
      "maxLength": 255,
      "description": "A sibling .html file holding a second layout for phones, drawn instead of the regular one on a screen 640px wide or less and in the mobile app. Defaults to '<id>.mobile.html' when that file exists. Uses the same tags, attributes and directives as the regular layout, and may exist even when the sheet uses a simple JSON 'layout'."
    },
    "mobile_styles_file": {
      "type": "string",
      "maxLength": 255,
      "description": "A sibling .css file styling the phone layout. Defaults to '<id>.mobile.css' when that file exists. Same CSS subset as 'styles_file'; needs a phone layout to style."
    },
    "name_field": {
      "type": "string",
      "description": "A text field that holds the character's name. It starts as the name given when the character is created, and editing either one updates the other."
    }
  }
}
